{
  "version": "0.1",
  "publisher": {
    "name": "Test Site",
    "url": "https://test.example",
    "contact": "mailto:ai@test.example"
  },
  "defaults": {
    "standard": {
      "train-ai": {
        "state": "allow"
      },
      "search": {
        "state": "allow"
      }
    },
    "experimental": {
      "ai-input": {
        "state": "allow"
      }
    }
  },
  "rules": [
    {
      "match": {
        "path": "/m/x/*"
      },
      "experimental": {
        "ai-input": {
          "state": "deny"
        }
      }
    },
    {
      "match": {
        "path": "/m/*",
        "hostname": "m.test.example"
      },
      "standard": {
        "train-ai": {
          "state": "deny"
        }
      }
    },
    {
      "match": {
        "path": "/a/b/*",
        "hostname": "open.test.example"
      },
      "standard": {
        "train-ai": {
          "state": "allow"
        }
      }
    },
    {
      "match": {
        "path": "/a/*",
        "hostname": "closed.test.example"
      },
      "standard": {
        "train-ai": {
          "state": "deny"
        }
      }
    }
  ]
}
