{
  "version": "0.1",
  "publisher": {
    "name": "Test Site",
    "url": "https://test.example",
    "contact": "mailto:ai@test.example"
  },
  "defaults": {
    "standard": {
      "train-ai": {
        "state": "deny"
      },
      "search": {
        "state": "allow"
      }
    }
  },
  "rules": [
    {
      "match": {
        "path": "/*.pdf$"
      },
      "standard": {
        "train-ai": {
          "state": "allow"
        }
      }
    },
    {
      "match": {
        "path": "/about"
      },
      "standard": {
        "train-ai": {
          "state": "allow"
        }
      }
    },
    {
      "match": {
        "path": "/press/**"
      },
      "standard": {
        "train-ai": {
          "state": "allow"
        }
      }
    },
    {
      "match": {
        "path": "/drafts*"
      },
      "standard": {
        "train-ai": {
          "state": "deny"
        }
      }
    }
  ]
}
